{
  "id": "epl9t_liveries",
  "series": "ЕПЛ9Т",
  "meta": {
    "verified": false,
    "sources": [],
    "note": "Художні окраси за мотивами фото; не фірмовий стиль Перші дві схеми — за фото ЕПЛ2Т (споріднена луганська серія), надісланими користувачем 19.10.2026; кольори підібрано на око."
  },
  "liveries": [
    {
      "id": "uz_cream_blue",
      "name_uk": "УЗ кремово-синій (як ЕПЛ2Т)",
      "short_name_uk": "Кремово-синій",
      "body": "#22305a",
      "lower_body": "#e4d2a2",
      "stripe": "#a8262a",
      "skirt": "#20283a",
      "roof": "#a7aaa8",
      "front": "#a8262a",
      "front_stripe": "#e4d2a2",
      "window_frame": "#1c262c",
      "number": "#22305a",
      "doors": "#22305a",
      "front_lower": "#22305a",
      "plow": "#a8262a"
    },
    {
      "id": "uz_cherry_cream",
      "name_uk": "УЗ вишнево-кремовий (як ЕПЛ2Т)",
      "short_name_uk": "Вишнево-крем.",
      "body": "#6a141b",
      "lower_body": "#d9c48c",
      "stripe": "#9c1f24",
      "skirt": "#3a2a2a",
      "roof": "#a9a9a4",
      "front": "#7e1820",
      "front_stripe": "#d9c48c",
      "window_frame": "#1c262c",
      "number": "#d9c48c",
      "doors": "#6a141b",
      "front_chevron": true,
      "plow": "#c9a227"
    },
    {
      "id": "epl9t_luhansk",
      "name_uk": "Сіро-синій луганський",
      "short_name_uk": "Сіро-синій",
      "body": "#d6dadb",
      "stripe": "#1f5aa6",
      "skirt": "#2b3034",
      "roof": "#9aa2a8",
      "front": "#1f5aa6",
      "front_stripe": "#f2f4f4",
      "window_frame": "#1c262c",
      "number": "#f2ead2",
      "lower_body": "#1f5aa6"
    },
    {
      "id": "epl9t_green",
      "name_uk": "Зелений приміський",
      "short_name_uk": "Зелений",
      "body": "#2e6a47",
      "stripe": "#eeeeea",
      "skirt": "#2b3034",
      "roof": "#8f9592",
      "front": "#2e6a47",
      "front_stripe": "#eeeeea",
      "window_frame": "#1c262c",
      "number": "#f2ead2"
    },
    {
      "id": "epl9t_white_red",
      "name_uk": "Біло-червоний",
      "short_name_uk": "Біло-червоний",
      "body": "#eceeee",
      "stripe": "#c32c33",
      "skirt": "#2b3034",
      "roof": "#a7adb1",
      "front": "#c32c33",
      "front_stripe": "#eceeee",
      "window_frame": "#1c262c",
      "number": "#f2ead2",
      "doors": "#c32c33",
      "lower_body": "#c32c33"
    },
    {
      "id": "epl9t_yellow_blue",
      "name_uk": "Жовто-синій",
      "short_name_uk": "Жовто-синій",
      "body": "#f0c43a",
      "stripe": "#1f4f96",
      "skirt": "#2b3034",
      "roof": "#9aa2a8",
      "front": "#1f4f96",
      "front_stripe": "#f0c43a",
      "window_frame": "#1c262c",
      "number": "#f2ead2",
      "lower_body": "#1f4f96"
    }
  ]
}
